{
  "schema_version": "v1",
  "id": "eval-docs-001",
  "target_artifact_ids": ["artifact-docs-001"],
  "result": "pass",
  "score": 0.93,
  "feedback": [
    "The repository entrypoint is now explicit.",
    "The layout distinguishes contracts from examples."
  ],
  "retryable": false,
  "risk_level": "low",
  "evidence": [
    "README references canonical spec and strategy docs.",
    "Layer directories and shared schemas are present."
  ],
  "evaluated_at": "2026-04-11T13:16:33Z"
}
